{
  "schema": "solarpunk.constraint.policy_manifest.v1",
  "id": "SPK-ENERGY-001",
  "version": "1.0.0",
  "name": "SPK Reference Application",
  "description": "Reference application policy retaining SPK as one bounded-issuance experiment rather than the protocol itself.",
  "min_provenance_level": "L1",
  "admission": {
    "require_positive_surplus": true,
    "require_zero_blockers": true,
    "require_signed_evidence": true,
    "require_external_corroboration": false
  },
  "issuance": {
    "unit": "SPK",
    "decimals": 6,
    "rate_per_surplus_kwh": 1,
    "haircut_pct": 60,
    "absolute_cap": 250
  },
  "settlement": {
    "explicit_capacity_required": true,
    "legal_redemption_not_implied": true
  },
  "governance": {
    "authority": "SPK reference policy",
    "mutable_by": "governed policy registry"
  }
}
